{
  "schema_version": "1.0",
  "lesson_id": "ma-g3-tech-cs-u01-l01",
  "unit_id": "ma-g3-tech-cs-u01",
  "subject": "technology",
  "band": "g3-4",
  "grade": 3,
  "grade_dir": "grade-03",
  "unit_title": "Digital Citizenship and Online Safety Basics",
  "lesson_title": "Launch and diagnostic: being kind online",
  "phase": "Launch and diagnostic",
  "work_mode": "PROBE",
  "focus": "being kind online",
  "scoring_authority_kind": "RUBRIC",
  "scoring_stance": "FORMATIVE_NO_PENALTY",
  "rubric": [
    {
      "dimension": "prediction and honesty",
      "exceeds": "The prior-knowledge record is complete and candid, including predictions that turned out wrong, and each break is marked rather than quietly corrected.",
      "meets": "A prediction was recorded before instruction and the outcome of checking it is stated.",
      "developing": "A prediction exists but was partly written or revised after seeing the answer, or the checking outcome is vague.",
      "beginning": "No usable record of prior thinking exists from before instruction."
    },
    {
      "dimension": "process documentation",
      "exceeds": "The record shows the actual working order, including abandoned attempts and dead ends, in enough detail to reconstruct the session.",
      "meets": "The required log, trace, or notes are present and record what was done and why.",
      "developing": "Documentation exists but is thin, out of order, or written after the fact from memory.",
      "beginning": "Little or no record of the process was kept."
    }
  ],
  "scoring_judgment_guidance": "Score this session with the rubric below, not against a fixed answer key — a design, code, or debugging task legitimately has more than one valid solution. Score only what a diagnostic probe on being kind online can show: a wrong prediction or a rough first attempt is expected here and must not reduce the score, provided the record is complete and honest. Record the level reached on each dimension with one specific reason drawn from the actual submission. Do not infer effort, motivation, diagnosis, or character from an error.",
  "lesson_success_criteria": [
    "The learner completes the central task about being kind online.",
    "The learner gives evidence, reasoning, a model, or a documented process rather than an unsupported answer.",
    "The learner checks or revises the work and can identify a next step."
  ],
  "formative_check": "In one concise response, show or explain the most important idea about being kind online; then identify one check that would catch an error or weak claim.",
  "answer_or_scoring_guidance": "Score the stated learning target, accuracy, evidence/reasoning, and revision. Accept multiple valid approaches when they meet the criteria. Do not infer effort, motivation, diagnosis, or character from an error.",
  "mastery_rule": "Do not mark mastery from one answer. Use digital artifact, algorithm or code, test log, source record, design explanation, and safe-use reflection; require accurate independent evidence and successful transfer or retrieval on at least two occasions when feasible.",
  "unit_assessment_reference": {
    "assessment_id": "ma-g3-tech-cs-u01-assessment",
    "total_points": 38,
    "unit_rubric_dimensions": [
      "accuracy or fidelity",
      "evidence and reasoning",
      "application or performance",
      "checking and revision"
    ],
    "mastery_interpretation": {
      "secure": "At least 85% with accurate independent application and adequate evidence/reasoning.",
      "developing": "70–84% or inconsistent explanation; assign targeted review and a fresh transfer check.",
      "not_yet": "Below 70% or a missing prerequisite; reteach the smallest gap and reassess with new evidence.",
      "rule": "A unit score is one evidence source, not the sole basis for long-term mastery."
    },
    "note": "This lesson is one session inside the unit; the unit assessment record above is the summative instrument, and this lesson rubric scores only this session's evidence."
  },
  "remediation_plan": "Reteaching for being kind online follows the signal actually observed, not a fixed script. If the signal is \"prerequisite gap\": Return to the smallest prerequisite needed for being kind online, model it with a concrete or text-only representation, then retry one fresh item. If the signal is \"procedure without understanding\": Ask the learner to explain or represent why the process for being kind online works before continuing. If the signal is \"correct but low confidence\": Confirm the reasoning specifically, offer one varied example of being kind online, and avoid unnecessary remediation. If the signal is \"repeated error pattern\": Name the observable pattern neutrally, contrast it with a worked example, and schedule a short same-day or next-session review. If the signal is \"mastery evidence\": Require accurate independent application plus explanation on a later or different occasion before marking being kind online mastered. Re-check with one fresh item of the same kind before moving on, and record which signal was seen so the pattern is visible across the unit rather than treated as a one-off.",
  "extension_plan": "Apply being kind online under a new constraint, compare two approaches or perspectives, or teach the idea with an original example without completing another learner’s graded work. Treat this as optional depth on being kind online rather than extra volume: one harder case done well beats three more of the same. Extension work stays inside the same sandbox rules — no real credentials and no live external systems. Extension work is never required to reach mastery and must not be assigned as a penalty.",
  "accommodation_note": "Access supports may change format, pacing, quantity, setting, or response mode without changing the standard being assessed.",
  "accessibility_options": [
    "Provide readable text plus optional audio or read-aloud support; no voice feature is required.",
    "Chunk directions into one action at a time and show a worked example or model.",
    "Allow typed, handwritten, spoken, drawn, manipulatives-based, or demonstrated responses when the standard permits.",
    "Offer reduced-copying, extended-time, hidden-timer, movement-break, and low-distraction options.",
    "Use captions, alt text, high-contrast print, keyboard access, and text-only fallbacks for media.",
    "Preserve the learning target while adjusting quantity, pacing, representation, or response mode."
  ],
  "task_accessibility_provisions": [
    "You can do this with the keyboard only, no mouse needed. Text can be made bigger, and you may do it on paper instead of a screen.",
    "You can take a break, stretch, or come back to this later. That does not lower your score."
  ],
  "parent_or_guardian_visibility": "Share the lesson target, completion state, evidence type, and next instructional step. Do not expose raw private reflections, raw answers, voice recordings, or diagnosis language. For safety-critical tasks, record only the needed guardian confirmation.",
  "source_integrity": {
    "requires_review": false,
    "status": "NOT_APPLICABLE"
  },
  "safety_and_privacy": {
    "requires_review": true,
    "status": "VERIFIED",
    "note": "No real credential, live external system, production account, or real personal data is used anywhere in this session; all values are fictional or sandboxed and no live system may be probed or accessed."
  },
  "standards": [
    "Michigan Computer Science: Impacts of Computing",
    "Michigan Computer Science: Networks and the Internet"
  ]
}
